{
  "protocol": "1.0",
  "delivery_mode": "current",
  "security_generation": "77777777-7777-4777-8777-777777777777",
  "session_generation": 7,
  "deployment_id": "00000000-0000-4000-8000-000000000001",
  "host_id": "00000000-0000-4000-8000-000000000002",
  "collector_boot_id": "11111111-1111-4111-8111-111111111111",
  "batch_id": "22222222-2222-4222-8222-222222222222",
  "frames": [
    {
      "source_id": "33333333-3333-4333-8333-333333333333",
      "sequence": 42,
      "observed_wall_ms": 1789473600000,
      "estimated_utc_ms": 1789473600085,
      "offset_ms": 85,
      "uncertainty_ms": 4,
      "monotonic_start_ns": "100000000000",
      "monotonic_end_ns": "100016000000",
      "duration_ms": 16,
      "definition_revision": "mac-ollama-1",
      "incarnation_id": null,
      "quality": "measured",
      "provenance": {
        "source": "darwin_api",
        "method_revision": "darwin-host-candidate-1",
        "verification": "direct_capture",
        "observed_at_ms": 1789473600000,
        "source_artifact_sha256": null
      },
      "gauges": {
        "host.cpu.busy_ratio": {
          "value": 0.42,
          "quality": "measured",
          "missing_reason": null,
          "provenance": {
            "source": "darwin_api",
            "method_revision": "darwin-host-candidate-1",
            "verification": "direct_capture",
            "observed_at_ms": 1789473600000,
            "source_artifact_sha256": null
          }
        },
        "host.memory.pressure_level": {
          "value": "normal",
          "quality": "measured",
          "missing_reason": null,
          "provenance": {
            "source": "darwin_api",
            "method_revision": "darwin-host-candidate-1",
            "verification": "direct_capture",
            "observed_at_ms": 1789473600000,
            "source_artifact_sha256": null
          }
        },
        "host.memory.compressed_bytes": {
          "value": "2890000000",
          "quality": "measured",
          "missing_reason": null,
          "provenance": {
            "source": "darwin_api",
            "method_revision": "darwin-host-candidate-1",
            "verification": "direct_capture",
            "observed_at_ms": 1789473600000,
            "source_artifact_sha256": null
          }
        },
        "host.memory.swap_used_bytes": {
          "value": "2899181568",
          "quality": "measured",
          "missing_reason": null,
          "provenance": {
            "source": "darwin_api",
            "method_revision": "darwin-host-candidate-1",
            "verification": "direct_capture",
            "observed_at_ms": 1789473600000,
            "source_artifact_sha256": null
          }
        },
        "host.disk.free_bytes": {
          "value": "9007199254740993",
          "quality": "measured",
          "missing_reason": null,
          "provenance": {
            "source": "darwin_api",
            "method_revision": "darwin-host-candidate-1",
            "verification": "direct_capture",
            "observed_at_ms": 1789473600000,
            "source_artifact_sha256": null
          }
        }
      },
      "network_observations": [
        {
          "interface_id": "aaaaaaaaaaaaaaaaaaaaaaaaaaaaaaaaaaaaaaaaaaaaaaaaaaaaaaaaaaaaaaaa",
          "boot_id": "11111111-1111-4111-8111-111111111111",
          "counter_epoch_id": "55555555-5555-4555-8555-555555555555",
          "loopback": false,
          "received_bytes_total": "9007199254740993",
          "sent_bytes_total": "12",
          "missing": [],
          "provenance": {
            "source": "darwin_api",
            "method_revision": "net-rt-iflist2-candidate-1",
            "verification": "direct_capture"
          }
        }
      ],
      "model_observations": [],
      "process_observations": [
        {
          "host_id": "00000000-0000-4000-8000-000000000002",
          "boot_id": "11111111-1111-4111-8111-111111111111",
          "pid": 700,
          "process_start_identity": "100000000",
          "process_key": "bbbbbbbbbbbbbbbbbbbbbbbbbbbbbbbbbbbbbbbbbbbbbbbbbbbbbbbbbbbbbbbb",
          "display_basename": "ollama",
          "category": "selected_ollama",
          "target_id": "44444444-4444-4444-8444-444444444444",
          "association_quality": "verified",
          "cpu_busy_ratio": 0.1,
          "physical_footprint_bytes": "536870912",
          "missing": [],
          "provenance": {
            "source": "darwin_api",
            "method_revision": "darwin-proc-rusage-candidate-1",
            "verification": "direct_capture"
          }
        }
      ],
      "process_summary": {
        "eligible_pid_count": 100,
        "examined_pid_count": 100,
        "permission_denied_count": 2,
        "retained_process_count": 1,
        "enumeration_truncated": false,
        "coverage": "partial",
        "method_revision": "darwin-proc-rusage-candidate-1",
        "sample_interval_ms": 15000,
        "scan_duration_ms": 200
      },
      "capabilities_missing": [
        {
          "id": "gpu.busy_ratio",
          "reason": "unsupported_platform_contract",
          "detail_code": null
        }
      ]
    },
    {
      "source_id": "66666666-6666-4666-8666-666666666666",
      "sequence": 9,
      "observed_wall_ms": 1789473600000,
      "estimated_utc_ms": 1789473600085,
      "offset_ms": 85,
      "uncertainty_ms": 4,
      "monotonic_start_ns": "100020000000",
      "monotonic_end_ns": "102020000000",
      "duration_ms": 2000,
      "definition_revision": "mac-ollama-1",
      "incarnation_id": "88888888-8888-4888-8888-888888888888",
      "quality": "runtime_reported",
      "provenance": {
        "source": "runtime_api",
        "method_revision": "ollama-0.34.0-api-ps",
        "verification": "direct_capture"
      },
      "gauges": {
        "runtime.reachable": {
          "value": true,
          "quality": "runtime_reported",
          "missing_reason": null,
          "provenance": {
            "source": "runtime_api",
            "method_revision": "ollama-0.34.0-api-ps",
            "verification": "direct_capture"
          }
        }
      },
      "network_observations": [],
      "model_observations": [
        {
          "model_id": "99999999-9999-4999-8999-999999999991",
          "digest": "cccccccccccccccccccccccccccccccccccccccccccccccccccccccccccccccc",
          "loaded": true,
          "reported_size_bytes": "428970080",
          "reported_size_vram_bytes": "428970080",
          "missing": [],
          "provenance": {
            "source": "runtime_api",
            "method_revision": "ollama-0.34.0-api-ps",
            "verification": "direct_capture"
          }
        },
        {
          "model_id": "99999999-9999-4999-8999-999999999992",
          "digest": "dddddddddddddddddddddddddddddddddddddddddddddddddddddddddddddddd",
          "loaded": false,
          "reported_size_bytes": null,
          "reported_size_vram_bytes": null,
          "missing": [
            {
              "id": "runtime.model.reported_size_bytes",
              "reason": "field_omitted",
              "detail_code": null
            },
            {
              "id": "runtime.model.reported_size_vram_bytes",
              "reason": "field_omitted",
              "detail_code": null
            }
          ],
          "provenance": {
            "source": "runtime_api",
            "method_revision": "ollama-0.34.0-api-ps",
            "verification": "direct_capture"
          }
        }
      ],
      "process_observations": [],
      "process_summary": null,
      "capabilities_missing": [
        {
          "id": "runtime.queue_depth",
          "reason": "unsupported_platform_contract",
          "detail_code": null
        }
      ]
    },
    {
      "source_id": "66666666-6666-4666-8666-666666666666",
      "sequence": 10,
      "observed_wall_ms": 1789473630000,
      "estimated_utc_ms": 1789473630085,
      "offset_ms": 85,
      "uncertainty_ms": 4,
      "monotonic_start_ns": "103000000000",
      "monotonic_end_ns": "103001000000",
      "duration_ms": 1,
      "definition_revision": "mac-ollama-1",
      "incarnation_id": null,
      "quality": "runtime_reported",
      "provenance": {
        "source": "runtime_api",
        "method_revision": "ollama-0.34.0-bounded-read-v1",
        "verification": "direct_capture",
        "observed_at_ms": 1789473630000,
        "source_artifact_sha256": null
      },
      "gauges": {},
      "network_observations": [],
      "model_observations": [],
      "process_observations": [],
      "process_summary": null,
      "config_observation": {
        "target_id": "44444444-4444-4444-8444-444444444444",
        "config_hash": "7557b289c1fbd94238cbafc242466eb05c0c47a560d5f967c52ca9a28ab54c08",
        "previous_config_hash": null,
        "previous_observed_ms": null,
        "fields": {
          "server_version": "0.34.0",
          "server_build": null,
          "selected_model": null
        },
        "field_provenance": {
          "server_version": {
            "source": "runtime_api",
            "method_revision": "ollama-0.34.0-bounded-read-v1",
            "verification": "direct_capture",
            "observed_at_ms": 1789473630000,
            "source_artifact_sha256": null
          },
          "server_build": null,
          "selected_model": null
        }
      },
      "capabilities_missing": []
    }
  ]
}
